{"allowed_tools":[],"body":"Construct at most two minimal, behavior-distinct typed PROGRAM candidates from currently allowed tools; retain runtime identity as the control.","observable_applicability":{"const":true},"revision":1,"risk_guards":{},"schema_version":"skill-entry/1","skill_id":"build_contrastive_candidates","skill_kind":"bootstrap_procedure"}
